{
  "framework": "ISO20022",
  "title": "ISO 20022 Reference Bindings (BPO subset)",
  "version": "0.1.0",
  "publisher": "ISO",
  "registration_authority": "SWIFT (Registration Authority for ISO 20022)",
  "source": "https://www.iso20022.org/",
  "license_note": "ISO 20022 message definitions, business components, and data elements are published free-of-use and free-of-distribution by the Registration Authority (SWIFT) via iso20022.org. This file references their official identifiers and names and paraphrases descriptions in our own words; authoritative definitions live in the ISO 20022 Financial Repository. Only items BPO properties actually reference are listed.",

  "messages": [
    { "id": "ISO20022:sese.023", "name": "SecuritiesSettlementTransactionInstruction",                "description": "Instructs the receiver to settle a securities transaction; carries the parties, account, financial instrument, quantity, amount, trade and settlement dates, and conditions." },
    { "id": "ISO20022:sese.024", "name": "SecuritiesSettlementTransactionStatusAdvice",                "description": "Reports the current processing status of a previously instructed settlement transaction, including matched / pending / settled / cancelled / failed states and reason codes." },
    { "id": "ISO20022:sese.025", "name": "SecuritiesSettlementTransactionConfirmation",                "description": "Confirms that a settlement transaction has been settled, including the actual quantity and amount settled and the effective settlement date." },
    { "id": "ISO20022:sese.020", "name": "SecuritiesSettlementTransactionGenerationNotification",      "description": "Notifies that a settlement instruction has been generated by the system (typically by an FMI in response to an upstream trade or corporate-action event)." },
    { "id": "ISO20022:semt.013", "name": "IntraPositionMovementInstruction",                           "description": "Instructs a movement of securities within an account without a change of beneficial owner — e.g. blocking for collateral, hold-and-release for encumbrance, or earmarking for a pending settlement." },
    { "id": "ISO20022:setr.044", "name": "SubscriptionMultipleOrder",                                  "description": "Orders the subscription (issuance / first-acquisition) of one or more investment-fund units; the inward leg by which units enter the system." },
    { "id": "ISO20022:setr.054", "name": "RedemptionMultipleOrder",                                    "description": "Orders the redemption (return / cancellation) of one or more investment-fund units; the outward leg by which units leave the system." }
  ],

  "components": [
    { "id": "ISO20022:cmp/PartyIdentification",   "name": "PartyIdentification",   "description": "Identification of a party — name, identifier (BIC / LEI / other), country, address — used in any of the roles a party plays within a transaction (issuer, owner, deliverer, receiver, intermediary, etc.)." },
    { "id": "ISO20022:cmp/SecuritiesAccount",     "name": "SecuritiesAccount",     "description": "Identification of a securities account, including the account identifier and the party operating it. The account is the holding unit at which positions are recorded." },
    { "id": "ISO20022:cmp/FinancialInstrument",   "name": "FinancialInstrument",   "description": "Description of a financial instrument — its identifier (typically ISIN), its class, currency of denomination, and other defining attributes." },
    { "id": "ISO20022:cmp/SettlementDetails",     "name": "SettlementDetails",     "description": "Container for the settlement parameters of a transaction — settlement system, settlement date, parties, account, conditions, and operational flags." },
    { "id": "ISO20022:cmp/TransactionStatus",     "name": "TransactionStatus",     "description": "Status of a transaction — pending, matched, settled, cancelled, rejected, failed — together with reason codes that explain the current state." }
  ],

  "elements": [
    { "id": "ISO20022:elem/SettlementTransactionIdentification", "name": "SettlementTransactionIdentification", "description": "Unique identifier of a settlement transaction within the settlement system; the join key for status reports, confirmations, and cancellations.", "parent_component": "ISO20022:cmp/SettlementDetails" },
    { "id": "ISO20022:elem/SettlementDate",                      "name": "SettlementDate",                      "description": "The date on which a settlement is intended to occur or has occurred.",                                                                          "parent_component": "ISO20022:cmp/SettlementDetails" },
    { "id": "ISO20022:elem/TradeDate",                           "name": "TradeDate",                           "description": "The date on which the underlying trade was struck (typically earlier than the SettlementDate)." },
    { "id": "ISO20022:elem/SettlementAmount",                    "name": "SettlementAmount",                    "description": "The monetary amount to be settled, expressed as a value with a currency." },
    { "id": "ISO20022:elem/SettlementQuantity",                  "name": "SettlementQuantity",                  "description": "The quantity of the financial instrument to be settled, expressed either as face value (nominal) or as a unit count." },
    { "id": "ISO20022:elem/PartyRole",                           "name": "PartyRole",                           "description": "The functional role a party plays in a transaction or arrangement — e.g. issuer, holder, custodian, validator, deliverer, receiver, intermediary, minter. Expresses the party's position with respect to the transaction or asset, distinct from the party's identity (which is carried by PartyIdentification).", "parent_component": "ISO20022:cmp/PartyIdentification" }
  ]
}
